{
  "name": "built-in",
  "version": "0.3.0",
  "description": "Default LLM Slop Detector rules shipped with the extension",
  "chars": [
    { "char": "​", "name": "ZERO WIDTH SPACE (U+200B)", "severity": "warning", "replacement": "" },
    { "char": "‌", "name": "ZERO WIDTH NON-JOINER (U+200C)", "severity": "warning", "replacement": "" },
    { "char": "‍", "name": "ZERO WIDTH JOINER (U+200D)", "severity": "warning", "replacement": "" },
    { "char": "‎", "name": "LEFT-TO-RIGHT MARK (U+200E)", "severity": "warning", "replacement": "" },
    { "char": "‏", "name": "RIGHT-TO-LEFT MARK (U+200F)", "severity": "warning", "replacement": "" },
    { "char": "⁠", "name": "WORD JOINER (U+2060)", "severity": "warning", "replacement": "" },
    { "char": "﻿", "name": "ZERO WIDTH NO-BREAK SPACE / BOM (U+FEFF)", "severity": "warning", "replacement": "" },
    { "char": "­", "name": "SOFT HYPHEN (U+00AD)", "severity": "warning", "replacement": "" },
    { "char": " ", "name": "NO-BREAK SPACE (U+00A0)", "severity": "warning", "replacement": " " },
    { "char": " ", "name": "NARROW NO-BREAK SPACE (U+202F)", "severity": "warning", "replacement": " " },
    { "char": "‪", "name": "LEFT-TO-RIGHT EMBEDDING (U+202A)", "severity": "warning", "replacement": "" },
    { "char": "‫", "name": "RIGHT-TO-LEFT EMBEDDING (U+202B)", "severity": "warning", "replacement": "" },
    { "char": "‬", "name": "POP DIRECTIONAL FORMATTING (U+202C)", "severity": "warning", "replacement": "" },
    { "char": "‭", "name": "LEFT-TO-RIGHT OVERRIDE (U+202D)", "severity": "warning", "replacement": "" },
    { "char": "‮", "name": "RIGHT-TO-LEFT OVERRIDE (U+202E)", "severity": "warning", "replacement": "" },
    { "char": "⁦", "name": "LEFT-TO-RIGHT ISOLATE (U+2066)", "severity": "warning", "replacement": "" },
    { "char": "⁧", "name": "RIGHT-TO-LEFT ISOLATE (U+2067)", "severity": "warning", "replacement": "" },
    { "char": "⁨", "name": "FIRST STRONG ISOLATE (U+2068)", "severity": "warning", "replacement": "" },
    { "char": "⁩", "name": "POP DIRECTIONAL ISOLATE (U+2069)", "severity": "warning", "replacement": "" },
    { "char": "᠎", "name": "MONGOLIAN VOWEL SEPARATOR (U+180E)", "severity": "warning", "replacement": "" },
    { "char": "ᅠ", "name": "HANGUL JUNGSEONG FILLER (U+1160)", "severity": "warning", "replacement": "" },
    { "char": "ㅤ", "name": "HANGUL FILLER (U+3164)", "severity": "warning", "replacement": "" },
    { "char": " ", "name": "LINE SEPARATOR (U+2028)", "severity": "warning", "replacement": "\n" },
    { "char": " ", "name": "PARAGRAPH SEPARATOR (U+2029)", "severity": "warning", "replacement": "\n" },
    { "char": "—", "name": "EM DASH (U+2014)", "severity": "information", "replacement": "-" },
    { "char": "–", "name": "EN DASH (U+2013)", "severity": "information", "replacement": "-" },
    { "char": "…", "name": "HORIZONTAL ELLIPSIS (U+2026)", "severity": "information", "replacement": "..." },
    { "char": "“", "name": "LEFT DOUBLE QUOTATION MARK (U+201C)", "severity": "information", "replacement": "\"" },
    { "char": "”", "name": "RIGHT DOUBLE QUOTATION MARK (U+201D)", "severity": "information", "replacement": "\"" },
    { "char": "‘", "name": "LEFT SINGLE QUOTATION MARK (U+2018)", "severity": "information", "replacement": "'" },
    { "char": "’", "name": "RIGHT SINGLE QUOTATION MARK (U+2019)", "severity": "information", "replacement": "'" },
    { "char": "«", "name": "LEFT-POINTING DOUBLE ANGLE QUOTATION MARK (U+00AB)", "severity": "information", "suggestion": "often legitimate in French or German; no default fix" },
    { "char": "»", "name": "RIGHT-POINTING DOUBLE ANGLE QUOTATION MARK (U+00BB)", "severity": "information", "suggestion": "often legitimate in French or German; no default fix" },
    { "char": "′", "name": "PRIME (U+2032)", "severity": "information", "suggestion": "used in measurements (feet, arc-minutes); no default fix" },
    { "char": "″", "name": "DOUBLE PRIME (U+2033)", "severity": "information", "suggestion": "used in measurements (inches, arc-seconds); no default fix" },
    { "char": "·", "name": "MIDDLE DOT (U+00B7)", "severity": "information", "suggestion": "legitimate in Catalan and list separators; no default fix" }
  ],
  "phrases": [
    { "pattern": "\\bdelve(s|d|ing)?\\b", "reason": "LLM filler" },
    { "pattern": "\\bit'?s worth noting\\b", "reason": "LLM hedge" },
    { "pattern": "\\bit'?s important to note\\b", "reason": "LLM hedge" },
    { "pattern": "\\bin the ever[- ]evolving landscape\\b", "reason": "LLM cliché" },
    { "pattern": "\\bin today'?s fast[- ]paced world\\b", "reason": "LLM cliché" },
    { "pattern": "\\bnavigate the complexit(y|ies)\\b" },
    { "pattern": "\\ba testament to\\b" },
    { "pattern": "\\btapestry of\\b" },
    { "pattern": "\\brich tapestry\\b" },
    { "pattern": "\\bat the heart of\\b" },
    { "pattern": "\\bcrucial role\\b" },
    { "pattern": "\\bplay(s|ed|ing)? a (crucial|pivotal|key|vital) role\\b" },
    { "pattern": "\\bharness(es|ed|ing)? the power of\\b" },
    { "pattern": "\\bunlock(s|ed|ing)? the (potential|power|secrets)\\b" },
    { "pattern": "\\bleverag(e|es|ed|ing)\\b", "reason": "corporate-speak" },
    { "pattern": "\\bembark(s|ed|ing)? on (a|this) journey\\b" },
    { "pattern": "\\brealm of\\b" },
    { "pattern": "\\bmultifaceted\\b" },
    { "pattern": "\\bmeticulous(ly)?\\b" },
    { "pattern": "\\bunderscore(s|d)?\\b" },
    { "pattern": "\\bparamount\\b" },
    { "pattern": "\\bdive (in|into|deeper)\\b" },
    { "pattern": "\\bin conclusion,\\b" },
    { "pattern": "\\bwhen it comes to\\b" },
    { "pattern": "\\bthat said,\\b" },
    { "pattern": "\\bhowever, it'?s\\b" },
    { "pattern": "\\boverall,\\b" },
    { "pattern": "\\bultimately,\\b" },
    { "pattern": "\\bfoster(s|ed|ing)?\\b" },
    { "pattern": "\\bbustling\\b" },
    { "pattern": "\\bgame[- ]chang(er|ing)\\b", "reason": "buzzword" },
    { "pattern": "\\bcutting[- ]edge\\b", "reason": "buzzword" },
    { "pattern": "\\bstate[- ]of[- ]the[- ]art\\b", "reason": "buzzword" },
    { "pattern": "\\brevolutioniz(e|es|ed|ing)\\b" },
    { "pattern": "\\bseamless(ly)?\\b" },
    { "pattern": "\\brobust\\b" },
    { "pattern": "\\bholistic\\b" },
    { "pattern": "\\bsynerg(y|ies|istic)\\b", "reason": "corporate-speak" },
    { "pattern": "\\bparadigm shift\\b", "reason": "buzzword" }
  ]
}
