{
  "name": "pack:gemini",
  "version": "0.1.0",
  "description": "Google Gemini (and legacy Bard) mannerisms: breakdown-happy structure, enthusiastic openers/closers, identity disclaimers.",
  "phrases": [
    { "pattern": "\\bhere'?s (a |the |your )?(detailed |quick |brief |simple )?breakdown\\b", "reason": "Gemini structural tic" },
    { "pattern": "\\bhere'?s (a |the )?(quick |simple |brief )?rundown\\b", "reason": "Gemini structural tic" },
    { "pattern": "\\blet'?s break (it|this|that) down\\b", "reason": "Gemini structural tic" },
    { "pattern": "\\bbreaking (it|this|that) down\\b", "reason": "Gemini structural tic" },
    { "pattern": "\\bhere'?s (a |the )?(high[- ]level )?overview\\b", "reason": "Gemini structural tic" },
    { "pattern": "\\bhere'?s (a |the )?summary of\\b", "reason": "Gemini structural tic" },
    { "pattern": "\\bhere'?s how (it|this|that) works\\b", "reason": "Gemini structural tic" },
    { "pattern": "\\bhere'?s why (this|that|it) (works|matters|happens|is)\\b", "reason": "Gemini explainer tic" },
    { "pattern": "\\bthink of (it|this|them|\\w+) (as|like) (a|an|the)\\b", "reason": "Gemini analogy opener" },
    { "pattern": "\\bimagine (a|an|you|this|that|if)\\b", "reason": "Gemini analogy opener" },
    { "pattern": "\\bpicture (a|an|this|yourself)\\b", "reason": "Gemini analogy opener" },
    { "pattern": "\\bthis is where (\\w+ )?comes in(to play)?\\b", "reason": "Gemini explainer pivot" },
    { "pattern": "\\bthe (beauty|magic|power) of (\\w+ )?(is|lies in)\\b", "reason": "Gemini explainer cliche" },
    { "pattern": "\\bthat'?s where (\\w+ )?shines\\b", "reason": "Gemini explainer cliche" },
    { "pattern": "\\bat a high level\\b", "reason": "Gemini explainer cliche" },
    { "pattern": "\\bzoom(ing)? (in|out) (on|for)\\b", "reason": "Gemini metaphor" },
    { "pattern": "\\bunder the hood\\b", "reason": "Gemini metaphor" },
    { "pattern": "\\bi hope (this|that) (helps|makes sense|clarifies|was helpful)\\b", "reason": "Gemini closer" },
    { "pattern": "\\bhope (this|that) (helps|clarifies|makes sense)\\b", "reason": "Gemini closer" },
    { "pattern": "\\bhappy (coding|reading|writing|learning|building|exploring)!?\\b", "reason": "Gemini closer" },
    { "pattern": "\\blet me know if (you (have|need)|there'?s)\\b", "reason": "Gemini closer" },
    { "pattern": "\\b(please )?(feel free to|don'?t hesitate to) (ask|reach out)\\b", "reason": "Gemini closer" },
    { "pattern": "\\bif you (have|need) any (other |further |more )?questions\\b", "reason": "Gemini closer" },
    { "pattern": "\\bi'?m here to help\\b", "reason": "Gemini closer" },
    { "pattern": "\\bi'?d be (happy|glad|delighted) to (help|assist|explain)\\b", "reason": "Gemini sycophancy" },
    { "pattern": "\\b(that'?s|what) an? (fantastic|fascinating|wonderful|great|excellent|brilliant|insightful|thought[- ]provoking) (question|point|observation|idea)\\b", "reason": "Gemini sycophancy" },
    { "pattern": "\\bgreat (question|point|thought)!\\b", "reason": "Gemini sycophancy" },
    { "pattern": "\\bi'?m (a |an )?(large |)language model\\b", "reason": "Gemini identity disclaimer" },
    { "pattern": "\\bas (a |an )(large |)language model\\b", "reason": "Gemini identity disclaimer" },
    { "pattern": "\\bi'?m gemini\\b", "reason": "Gemini identity disclaimer" },
    { "pattern": "\\bi am gemini\\b", "reason": "Gemini identity disclaimer" },
    { "pattern": "\\btrained by google\\b", "reason": "Gemini identity disclaimer" },
    { "pattern": "\\bi was (created|built|developed|trained) by google\\b", "reason": "Gemini identity disclaimer" },
    { "pattern": "\\bi (don'?t|do not) have (personal |real )?(feelings|emotions|opinions|beliefs|experiences|preferences|consciousness)\\b", "reason": "Gemini identity disclaimer" },
    { "pattern": "\\bi (don'?t|do not) have the ability to\\b", "reason": "Gemini identity disclaimer" },
    { "pattern": "\\bi cannot (access|browse|see|view|open) (the )?(internet|web|real[- ]time|live)\\b", "reason": "Gemini capability disclaimer" },
    { "pattern": "\\bmy (knowledge|training data|information) (is |was )?(only )?(current |up to date |accurate )?(as of|through|until)\\b", "reason": "Gemini knowledge-cutoff disclaimer" },
    { "pattern": "\\bi (don'?t|do not|cannot) provide (medical|legal|financial|professional|tax) advice\\b", "reason": "Gemini professional-advice disclaimer" },
    { "pattern": "\\b(always |please )?(consult|seek (out )?|talk to) a (qualified |licensed |certified )?(professional|doctor|lawyer|financial advisor|specialist|expert)\\b", "reason": "Gemini professional-advice disclaimer" },
    { "pattern": "\\bkeep in mind (that|you|this|it)\\b", "reason": "Gemini hedge" },
    { "pattern": "\\bit'?s (also |worth )?(important|worth noting|good|useful|helpful) to (note|remember|mention|keep in mind|consider)\\b", "reason": "Gemini hedge" },
    { "pattern": "\\bone (important |key )?thing to (note|remember|keep in mind)\\b", "reason": "Gemini hedge" },
    { "pattern": "\\ba few (things|points|notes|caveats) to (keep in mind|consider|note)\\b", "reason": "Gemini hedge" },
    { "pattern": "\\btl;?dr:?\\b", "reason": "Gemini summary marker" },
    { "pattern": "^[ \t]*\\*\\*(overview|summary|tl;dr|key (takeaways?|points?)|in (short|summary)|the gist|bottom line)[:.]*\\*\\*", "reason": "Gemini bolded summary header" },
    { "pattern": "^[ \t]*\\*\\*(the )?(what|why|how|when|where|who)[:.]*\\*\\*", "reason": "Gemini bolded question-header" },
    { "pattern": "\\bkey takeaways?:?\\b", "reason": "Gemini summary marker" },
    { "pattern": "\\bin a nutshell,?\\b", "reason": "Gemini summary cliche" },
    { "pattern": "\\bthe gist (of it |is)\\b", "reason": "Gemini summary cliche" },
    { "pattern": "\\bsimply put,?\\b", "reason": "Gemini summary cliche" },
    { "pattern": "\\bput (simply|another way|differently),?\\b", "reason": "Gemini summary cliche" },
    { "pattern": "\\bin other words,?\\b", "reason": "Gemini pivot" },
    { "pattern": "\\brest assured\\b", "reason": "Gemini reassurance tic" },
    { "pattern": "\\byou'?(ve|re) got this\\b", "reason": "Gemini cheerleading" },
    { "pattern": "\\bgood luck (on|with) (your )?(journey|adventure|endeavor|project)\\b", "reason": "Gemini cheerleading closer" }
  ]
}
