{
  "name": "pack:llama",
  "version": "0.1.0",
  "description": "Meta Llama and Llama-family fine-tune tells: 'as an AI' disclaimers, refusal boilerplate, and special-token leaks.",
  "phrases": [
    { "pattern": "<\\|begin_of_text\\|>", "reason": "Llama special token leak", "severity": "warning" },
    { "pattern": "<\\|end_of_text\\|>", "reason": "Llama special token leak", "severity": "warning" },
    { "pattern": "<\\|start_header_id\\|>", "reason": "Llama3 chat template leak", "severity": "warning" },
    { "pattern": "<\\|end_header_id\\|>", "reason": "Llama3 chat template leak", "severity": "warning" },
    { "pattern": "<\\|eot_id\\|>", "reason": "Llama3 end-of-turn token leak", "severity": "warning" },
    { "pattern": "<\\|eom_id\\|>", "reason": "Llama3 end-of-message token leak", "severity": "warning" },
    { "pattern": "<\\|python_tag\\|>", "reason": "Llama3 tool-call token leak", "severity": "warning" },
    { "pattern": "\\[INST\\]", "reason": "Llama2/Mistral instruction tag leak", "severity": "warning" },
    { "pattern": "\\[/INST\\]", "reason": "Llama2/Mistral instruction tag leak", "severity": "warning" },
    { "pattern": "<<SYS>>", "reason": "Llama2 system tag leak", "severity": "warning" },
    { "pattern": "<</SYS>>", "reason": "Llama2 system tag leak", "severity": "warning" },
    { "pattern": "\\bas an ai\\b", "reason": "Llama identity disclaimer" },
    { "pattern": "\\bas an ai (language model|assistant|model|chatbot|system)\\b", "reason": "Llama identity disclaimer" },
    { "pattern": "\\bas a (large |)language model\\b", "reason": "Llama identity disclaimer" },
    { "pattern": "\\bi'?m (just |simply |only |merely )?an ai\\b", "reason": "Llama identity disclaimer" },
    { "pattern": "\\bi am (just |simply |only |merely )?an ai\\b", "reason": "Llama identity disclaimer" },
    { "pattern": "\\bi'?m llama\\b", "reason": "Llama identity disclaimer" },
    { "pattern": "\\bi am llama\\b", "reason": "Llama identity disclaimer" },
    { "pattern": "\\bi'?m (a |an )?(meta )?ai (assistant|model)\\b", "reason": "Llama identity disclaimer" },
    { "pattern": "\\b(created|developed|built|trained|made) by meta\\b", "reason": "Llama identity disclaimer" },
    { "pattern": "\\bi (don'?t|do not) have (personal |real )?(feelings|emotions|opinions|beliefs|consciousness|a body|personal experiences|preferences)\\b", "reason": "Llama identity disclaimer" },
    { "pattern": "\\bi (don'?t|do not) have the ability to\\b", "reason": "Llama capability disclaimer" },
    { "pattern": "\\bi (cannot|can'?t) (provide|assist with|help with|engage with|participate in|generate|create|produce)\\b", "reason": "Llama-Guard refusal boilerplate" },
    { "pattern": "\\bi'?m (not able|unable) to (provide|assist|help|fulfill|engage|generate|create|produce)\\b", "reason": "Llama-Guard refusal boilerplate" },
    { "pattern": "\\bi (cannot|can'?t|won'?t|will not) (fulfill|comply with|satisfy|honor) (this|that|your) request\\b", "reason": "Llama-Guard refusal boilerplate" },
    { "pattern": "\\bi must (decline|refuse|respectfully decline)\\b", "reason": "Llama-Guard refusal boilerplate" },
    { "pattern": "\\bi('?m| am) (not |un)?(comfortable|willing) (with|to)\\b", "reason": "Llama-Guard refusal boilerplate" },
    { "pattern": "\\bi (don'?t|do not) feel comfortable\\b", "reason": "Llama-Guard refusal boilerplate" },
    { "pattern": "\\bi apologize,?\\s+but i (cannot|can'?t|am (not |un))\\b", "reason": "Llama-Guard refusal boilerplate" },
    { "pattern": "\\bit (would not|wouldn'?t|is not|isn'?t) be (appropriate|responsible|ethical|safe)\\b", "reason": "Llama-Guard refusal boilerplate" },
    { "pattern": "\\bit'?s not (appropriate|responsible|ethical|safe) (to|for me to)\\b", "reason": "Llama-Guard refusal boilerplate" },
    { "pattern": "\\bthat (would|could|might) be (harmful|dangerous|unethical|inappropriate|offensive)\\b", "reason": "Llama-Guard refusal boilerplate" },
    { "pattern": "\\bi (prioritize|aim to provide|strive to (provide|be))\\b", "reason": "Llama safety preamble" },
    { "pattern": "\\bi'?m (designed|programmed|built|trained) to (be |provide |ensure )\\b", "reason": "Llama safety preamble" },
    { "pattern": "\\bmy (purpose|goal|role) is to (assist|help|provide|be|ensure)\\b", "reason": "Llama safety preamble" },
    { "pattern": "\\binstead,?\\s*(i can|may i|let me|i'?d (like|love) to) (suggest|offer|propose|recommend)\\b", "reason": "Llama pivot-to-safer-alternative" },
    { "pattern": "\\bis there (something|anything) else (i can help|you'?d like|you would like)\\b", "reason": "Llama closer" },
    { "pattern": "\\bi hope (this|that) (information |was )?(is |was )?(helpful|useful|informative|clear)\\b", "reason": "Llama closer" },
    { "pattern": "\\bif you have any (further |additional |more |other )?questions\\b", "reason": "Llama closer" },
    { "pattern": "\\bplease (let me know|don'?t hesitate to ask|feel free to ask)\\b", "reason": "Llama closer" },
    { "pattern": "\\bit'?s (important|essential|crucial|vital) to (note|remember|understand|recognize|consider)\\b", "reason": "Llama hedge" },
    { "pattern": "\\bplease (note|be aware|keep in mind|remember)\\b", "reason": "Llama hedge" },
    { "pattern": "\\bhowever,?\\s+it'?s (important|worth (noting|mentioning))\\b", "reason": "Llama hedge pivot" },
    { "pattern": "\\bkeep in mind (that|you|this|it)\\b", "reason": "Llama hedge" },
    { "pattern": "\\bit'?s (always )?(a )?(good|wise|smart|best) (idea|practice|approach) to\\b", "reason": "Llama hedge" },
    { "pattern": "\\b(always|never) (forget|remember) (to|that)\\b", "reason": "Llama imperative hedge" },
    { "pattern": "\\blet'?s (break|dive|get|jump) (this |it |right )?(down|in|into it|started)!?\\b", "reason": "Llama3 enthusiastic opener" },
    { "pattern": "\\byou'?re (on the right track|doing great|making progress)\\b", "reason": "Llama cheerleading" }
  ]
}
