{
  "name": "pack:qwen",
  "version": "0.1.0",
  "description": "Alibaba Qwen and QwQ mannerisms: cheerful openers, Alibaba identity disclaimers, and ChatML/reasoning-token leaks.",
  "phrases": [
    { "pattern": "<\\|im_start\\|>", "reason": "Qwen ChatML role token leak", "severity": "warning" },
    { "pattern": "<\\|im_end\\|>", "reason": "Qwen ChatML role token leak", "severity": "warning" },
    { "pattern": "<\\|endoftext\\|>", "reason": "Qwen special token leak", "severity": "warning" },
    { "pattern": "<\\|fim_(prefix|suffix|middle|pad)\\|>", "reason": "Qwen FIM token leak", "severity": "warning" },
    { "pattern": "<\\|object_ref_(start|end)\\|>", "reason": "Qwen-VL reference token leak", "severity": "warning" },
    { "pattern": "<\\|box_(start|end)\\|>", "reason": "Qwen-VL bbox token leak", "severity": "warning" },
    { "pattern": "<\\|quad_(start|end)\\|>", "reason": "Qwen-VL quad token leak", "severity": "warning" },
    { "pattern": "<\\|vision_(start|end|pad)\\|>", "reason": "Qwen-VL vision token leak", "severity": "warning" },
    { "pattern": "<\\|image_pad\\|>", "reason": "Qwen-VL image pad token leak", "severity": "warning" },
    { "pattern": "<\\|video_pad\\|>", "reason": "Qwen-VL video pad token leak", "severity": "warning" },
    { "pattern": "<\\s*/?\\s*think\\s*>", "reason": "QwQ/Qwen3 thinking tag leak", "severity": "warning" },
    { "pattern": "<\\s*/?\\s*tool_call\\s*>", "reason": "Qwen tool-call tag leak", "severity": "warning" },
    { "pattern": "<\\s*/?\\s*tool_response\\s*>", "reason": "Qwen tool-response tag leak", "severity": "warning" },
    { "pattern": "\\bi'?m qwen\\b", "reason": "Qwen identity disclaimer" },
    { "pattern": "\\bi am qwen\\b", "reason": "Qwen identity disclaimer" },
    { "pattern": "\\bi'?m qwq\\b", "reason": "QwQ identity disclaimer" },
    { "pattern": "\\b(developed|created|built|made|trained) by alibaba( cloud)?\\b", "reason": "Qwen identity disclaimer" },
    { "pattern": "\\bi'?m an? (ai )?(assistant|language model) (developed|created|built|made|trained) by alibaba\\b", "reason": "Qwen identity disclaimer" },
    { "pattern": "\\btongyi( qianwen)?\\b", "reason": "Qwen identity disclaimer" },
    { "pattern": "\\bi('?m| am) a (helpful|large) (language model|ai)\\b", "reason": "Qwen identity disclaimer" },
    { "pattern": "^[ \t]*sure!?,?\\s+(let'?s|here'?s|i(\\s|'))", "reason": "Qwen opener" },
    { "pattern": "^[ \t]*sure thing!?,?\\s", "reason": "Qwen opener" },
    { "pattern": "^[ \t]*of course!?,?\\s+(let'?s|here'?s|i(\\s|'))", "reason": "Qwen opener" },
    { "pattern": "^[ \t]*no problem!?,?\\s", "reason": "Qwen opener" },
    { "pattern": "^[ \t]*(great|awesome|perfect|wonderful|excellent)!?,?\\s+(let'?s|here'?s|now|i(\\s|'))", "reason": "Qwen opener" },
    { "pattern": "\\bhappy to help!?\\b", "reason": "Qwen closer" },
    { "pattern": "\\bi'?m happy to help\\b", "reason": "Qwen closer" },
    { "pattern": "\\bglad (i could|to) help\\b", "reason": "Qwen closer" },
    { "pattern": "\\blet'?s (walk|go) through (this|it|them) (step by step|together|one by one)\\b", "reason": "Qwen decomposition tic" },
    { "pattern": "\\bhere'?s (a |the )?step[- ]by[- ]step (guide|walkthrough|explanation|approach|breakdown)\\b", "reason": "Qwen decomposition tic" },
    { "pattern": "\\bstep[- ]by[- ]step:\\s", "reason": "Qwen section marker" },
    { "pattern": "\\blet me (try to |attempt to )?(figure (this|it) out|work through (this|it))\\b", "reason": "QwQ reasoning leak" },
    { "pattern": "\\bhmm,?\\s+let me (see|think|check|try)\\b", "reason": "QwQ reasoning leak" },
    { "pattern": "\\bwait,?\\s+(but|no|let me|i|is)\\b", "reason": "QwQ self-correction leak" },
    { "pattern": "\\bokay,?\\s+so\\b", "reason": "QwQ reasoning preamble" },
    { "pattern": "\\bi think i (need to|should|have to) (reconsider|rethink|double[- ]check)\\b", "reason": "QwQ self-correction leak" },
    { "pattern": "\\bmake sense\\?\\s*$", "reason": "Qwen check-in closer" },
    { "pattern": "\\bdoes that (help|make sense|answer your question|clarify)\\?", "reason": "Qwen check-in closer" },
    { "pattern": "\\bfeel free to ask (any |if you have )?(more |further |any other )?questions\\b", "reason": "Qwen closer" },
    { "pattern": "\\bi'?ll (do my best|try my best|try) to\\b", "reason": "Qwen hedge" },
    { "pattern": "\\bthat'?s a (really |very )?(good|great|interesting|thoughtful) (question|point)\\b", "reason": "Qwen sycophancy" },
    { "pattern": "\\bnote that,?\\s", "reason": "Qwen hedge" },
    { "pattern": "\\bit'?s (also )?worth (noting|mentioning|pointing out)\\b", "reason": "Qwen hedge" }
  ]
}
