{
  "name": "pack:deepseek",
  "version": "0.1.0",
  "description": "DeepSeek V3/R1 mannerisms, most notably reasoning-trace tokens and thinking-phase tics that leak into finished output.",
  "phrases": [
    { "pattern": "<\\s*/?\\s*think\\s*>", "reason": "DeepSeek R1 reasoning tag leak", "severity": "warning" },
    { "pattern": "<\\s*/?\\s*thinking\\s*>", "reason": "reasoning tag leak", "severity": "warning" },
    { "pattern": "<\\s*/?\\s*reasoning\\s*>", "reason": "reasoning tag leak", "severity": "warning" },
    { "pattern": "<\\s*/?\\s*reflection\\s*>", "reason": "reasoning tag leak", "severity": "warning" },
    { "pattern": "<\\|\\s*(begin|end)_of_thought\\s*\\|>", "reason": "DeepSeek thought delimiter leak", "severity": "warning" },
    { "pattern": "<\\|\\s*(begin|end)_of_solution\\s*\\|>", "reason": "DeepSeek solution delimiter leak", "severity": "warning" },
    { "pattern": "<\\|fim_(begin|hole|end)\\|>", "reason": "DeepSeek FIM token leak", "severity": "warning" },
    { "pattern": "<\\|EOT\\|>", "reason": "DeepSeek end-of-turn token leak", "severity": "warning" },
    { "pattern": "^[ \t]*wait,?\\s", "reason": "R1 reasoning tic leaking into output" },
    { "pattern": "^[ \t]*(but |so |and )?wait,\\s", "reason": "R1 self-correction leak" },
    { "pattern": "^[ \t]*hmm+,?\\s", "reason": "R1 reasoning tic leaking into output" },
    { "pattern": "^[ \t]*(ah|aha|oh),?\\s", "reason": "R1 reasoning-interjection leak" },
    { "pattern": "^[ \t]*okay,?\\s*(so|let'?s|let me|now)\\b", "reason": "R1 reasoning preamble leak" },
    { "pattern": "^[ \t]*alright,?\\s*(so|let'?s|let me|now)\\b", "reason": "R1 reasoning preamble leak" },
    { "pattern": "\\blet me (think|reason|work|figure) (about |through |out )?(this|it|that) (out |through )?(step[- ]by[- ]step|carefully|first)?\\b", "reason": "R1 meta-reasoning leak" },
    { "pattern": "\\blet me re[- ]?(examine|check|verify|think|evaluate|analyze|consider)\\b", "reason": "R1 self-correction leak" },
    { "pattern": "\\blet me double[- ]check\\b", "reason": "R1 self-correction leak" },
    { "pattern": "\\bactually,?\\s*wait\\b", "reason": "R1 self-correction leak" },
    { "pattern": "\\bon second thought\\b", "reason": "R1 self-correction leak" },
    { "pattern": "\\bhold on,?\\b", "reason": "R1 self-correction leak" },
    { "pattern": "\\bi need to (think|reconsider|double[- ]check|verify)\\b", "reason": "R1 meta-reasoning leak" },
    { "pattern": "\\bi should (think|reconsider|double[- ]check|verify|make sure)\\b", "reason": "R1 meta-reasoning leak" },
    { "pattern": "\\bthe user (is asking|wants|is looking for|is trying)\\b", "reason": "R1 internal-monologue leak" },
    { "pattern": "\\bthe user'?s (question|query|request|prompt|goal|intent)\\b", "reason": "R1 internal-monologue leak" },
    { "pattern": "\\bso the user (is asking|wants|is looking for|is trying|said|mentioned)\\b", "reason": "R1 internal-monologue leak" },
    { "pattern": "\\bfirst,? let me\\b", "reason": "R1 reasoning preamble" },
    { "pattern": "\\bfirst,? i'?ll\\b", "reason": "R1 reasoning preamble" },
    { "pattern": "\\bfirst,? i need to\\b", "reason": "R1 reasoning preamble" },
    { "pattern": "\\bstep[- ]by[- ]step\\b", "reason": "R1 reasoning preamble" },
    { "pattern": "\\blet'?s think step[- ]by[- ]step\\b", "reason": "R1 reasoning preamble" },
    { "pattern": "\\bi('?m| am) going to (think|reason|work) through\\b", "reason": "R1 meta-reasoning leak" },
    { "pattern": "\\bbreaking (it|this) down into\\b", "reason": "R1 decomposition tic" },
    { "pattern": "\\bto summarize my (thinking|reasoning|thoughts)\\b", "reason": "R1 self-summary leak" },
    { "pattern": "\\bputting (it|this) all together\\b", "reason": "R1 conclusion tic" },
    { "pattern": "\\bcrucially,?\\s", "reason": "DeepSeek emphasis tic" },
    { "pattern": "\\bnotably,?\\s", "reason": "DeepSeek emphasis tic" },
    { "pattern": "\\bof note,?\\s", "reason": "DeepSeek emphasis tic" },
    { "pattern": "\\bindeed,?\\s", "reason": "DeepSeek affirmation tic" },
    { "pattern": "\\bthe key (insight|observation|realization|idea) (here |is )?\\b", "reason": "DeepSeek conclusion tic" },
    { "pattern": "\\bthe (main|key|core|central) (point|takeaway|idea) (here |is )?\\b", "reason": "DeepSeek conclusion tic" },
    { "pattern": "\\bi'?m deepseek\\b", "reason": "DeepSeek identity disclaimer" },
    { "pattern": "\\bi am deepseek\\b", "reason": "DeepSeek identity disclaimer" },
    { "pattern": "\\bi'?m an (ai )?(assistant|language model) (created |developed |made |trained )?by deepseek\\b", "reason": "DeepSeek identity disclaimer" }
  ]
}
