{
  "name": "pack:openai",
  "version": "0.2.0",
  "description": "OpenAI GPT / ChatGPT tells: citation-markup artifact leaks (oaicite, contentReference, attributableIndex, the U+E200-U+E203 private-use citation delimiters, utm_source=chatgpt.com), AI-identity and knowledge-cutoff disclaimers, refusal boilerplate, and stock opener/closer/hedge scaffolding. Original content -- regexes hand-authored to match commonly-observed stock phrasing; no third-party rule set incorporated.",
  "chars": [
    { "char": "\ue200", "name": "PRIVATE USE U+E200 (ChatGPT citation delimiter)", "severity": "warning", "replacement": "" },
    { "char": "\ue201", "name": "PRIVATE USE U+E201 (ChatGPT citation delimiter)", "severity": "warning", "replacement": "" },
    { "char": "\ue202", "name": "PRIVATE USE U+E202 (ChatGPT citation delimiter)", "severity": "warning", "replacement": "" },
    { "char": "\ue203", "name": "PRIVATE USE U+E203 (ChatGPT citation delimiter)", "severity": "warning", "replacement": "" }
  ],
  "phrases": [
    { "pattern": "\\boaicite\\b", "reason": "ChatGPT citation-markup artifact leak" },
    { "pattern": "\\boai_citation\\b", "reason": "ChatGPT citation-markup artifact leak" },
    { "pattern": "\\bcontentReference\\b", "reason": "ChatGPT citation-markup artifact leak", "severity": "warning" },
    { "pattern": ":contentReference\\[oaicite", "reason": "ChatGPT citation-markup artifact leak", "severity": "warning" },
    { "pattern": "\\battributableIndex\\b", "reason": "ChatGPT citation-markup artifact leak", "severity": "warning" },
    { "pattern": "\\b(cite|filecite|navlist|video)turn\\d+", "reason": "ChatGPT citation token leak (invisible delimiters stripped)", "severity": "warning" },
    { "pattern": "utm_source=(chatgpt\\.com|openai)", "reason": "ChatGPT-generated reference URL tracking parameter", "severity": "warning" },
    { "pattern": "\\bturn\\d+(search|news|view|image|forecast|finance)\\d+\\b", "reason": "ChatGPT web-tool citation token leak", "severity": "warning" },
    { "pattern": "\\bas an? (AI|artificial intelligence)(,| developed| created| trained| language model| assistant)", "reason": "GPT identity disclaimer", "severity": "warning" },
    { "pattern": "\\bas a large language model\\b", "reason": "GPT identity disclaimer", "severity": "warning" },
    { "pattern": "\\bas of my last (knowledge |training )?(update|cutoff|knowledge update)\\b", "reason": "GPT knowledge-cutoff disclaimer", "severity": "warning" },
    { "pattern": "\\bknowledge cut[- ]?off\\b", "reason": "GPT knowledge-cutoff disclaimer", "severity": "warning" },
    { "pattern": "\\bmy (training data|training|knowledge)( only)? (includes|extends|goes|is limited|cuts off|stops)\\b", "reason": "GPT knowledge-cutoff disclaimer", "severity": "warning" },
    { "pattern": "\\bI (don'?t|do not) have (access to |the ability to )?(real[- ]time|live|up[- ]to[- ]date|current|personal)\\b", "reason": "GPT capability disclaimer", "severity": "warning" },
    { "pattern": "\\bI (can'?t|cannot|am unable to|am not able to) (fulfill|comply with|assist with|help with) (that|this) request\\b", "reason": "GPT refusal boilerplate", "severity": "warning" },
    { "pattern": "\\bI'?m (sorry|afraid),? but (as|I)\\b", "reason": "GPT refusal boilerplate" },
    { "pattern": "^\\s*Certainly[!,]", "reason": "GPT opener" },
    { "pattern": "^\\s*Sure(?: thing)?[!,]", "reason": "GPT opener" },
    { "pattern": "^\\s*Sure,? (here'?s|here is|I can|let me)\\b", "reason": "GPT opener" },
    { "pattern": "\\bGreat question[!.]", "reason": "GPT opener" },
    { "pattern": "\\bI'?d be (happy|glad) to (help|assist)\\b", "reason": "GPT opener" },
    { "pattern": "\\bhere'?s a (comprehensive|detailed|quick|brief|step[- ]by[- ]step) (overview|breakdown|rundown|guide|look)\\b", "reason": "GPT framing" },
    { "pattern": "\\blet me break (this|it) down( for you)?\\b", "reason": "GPT framing" },
    { "pattern": "\\bI hope (this|that) (helps|information helps|answers your question)\\b", "reason": "GPT closer" },
    { "pattern": "\\blet me know if (you (have|need)|there'?s|you'?d like|you want)\\b", "reason": "GPT closer" },
    { "pattern": "\\b(feel free|don'?t hesitate) to (ask|reach out|let me know)\\b", "reason": "GPT closer" },
    { "pattern": "\\bis there anything else (I can|you'?d like)\\b", "reason": "GPT closer" },
    { "pattern": "\\bgenerally speaking,?\\b", "reason": "GPT hedge" },
    { "pattern": "\\bit'?s (important|worth|essential) to (note|remember|keep in mind|mention) that\\b", "reason": "GPT hedge" },
    { "pattern": "\\bdepending on (the|your) (context|specific|particular|needs|situation)\\b", "reason": "GPT hedge" }
  ]
}
