{
  "name": "pack:grok",
  "version": "0.3.0",
  "description": "xAI Grok mannerisms: conversational 'look,' openers, forced edginess, Hitchhiker's Guide references, and Elon/X name-drops.",
  "phrases": [
    { "pattern": "^\\s*look,?\\s", "reason": "Grok opener" },
    { "pattern": "^\\s*alright,?\\s", "reason": "Grok opener" },
    { "pattern": "^\\s*so,?\\s+(here'?s|let'?s|you|i)\\b", "reason": "Grok opener" },
    { "pattern": "^\\s*oh,?\\s+(boy|man|hell|wow|nice|good (one|question))\\b", "reason": "Grok opener" },
    { "pattern": "\\bhere'?s the (deal|scoop|gist|rundown|skinny|lowdown|tea)\\b", "reason": "Grok structural tic" },
    { "pattern": "\\blet'?s (cut|get) (straight |right )?to the (chase|point|heart of it)\\b", "reason": "Grok forced-directness" },
    { "pattern": "\\bno (fluff|BS|bullshit|sugar[- ]?coating|hand[- ]?waving)\\b", "reason": "Grok forced-directness" },
    { "pattern": "\\bstraight up,?\\b", "reason": "Grok forced-directness" },
    { "pattern": "\\bhonestly\\?,?\\s", "reason": "Grok forced-directness" },
    { "pattern": "\\breal talk,?\\b", "reason": "Grok forced-directness" },
    { "pattern": "\\blet'?s be real\\b", "reason": "Grok forced-directness" },
    { "pattern": "\\bnot gonna lie,?\\b", "reason": "Grok forced-directness" },
    { "pattern": "\\bngl,?\\s", "reason": "Grok forced-directness" },
    { "pattern": "\\bbuckle up\\b", "reason": "Grok hype" },
    { "pattern": "\\bhold onto your (hat|hats|seat|seats|butts)\\b", "reason": "Grok hype" },
    { "pattern": "\\bstrap in\\b", "reason": "Grok hype" },
    { "pattern": "\\bwild ride\\b", "reason": "Grok hype" },
    { "pattern": "\\bmind[- ]?(blown|blowing)\\b", "reason": "Grok hype" },
    { "pattern": "\\b(that'?s |it'?s )?(pretty |absolutely |genuinely )?wild\\b", "reason": "Grok hype" },
    { "pattern": "\\bpretty (cool|wild|neat|sick|dope|slick|rad)\\b", "reason": "Grok hype" },
    { "pattern": "\\bspicy (take|question|one|topic)\\b", "reason": "Grok edginess" },
    { "pattern": "\\bbased\\b", "reason": "Grok edginess / 4chan-ism" },
    { "pattern": "\\bcope\\b", "reason": "Grok edginess" },
    { "pattern": "\\bbig[- ]brain(ed)?\\b", "reason": "Grok edginess" },
    { "pattern": "\\bgalaxy[- ]brain(ed)?\\b", "reason": "Grok edginess" },
    { "pattern": "\\bwoke\\b", "reason": "Grok edginess" },
    { "pattern": "\\bnpc\\b", "reason": "Grok edginess" },
    { "pattern": "\\b42\\s*(,|--|\\.|\\)|\\s+is)\\s*the\\s*answer\\b", "reason": "Grok Hitchhiker's reference" },
    { "pattern": "\\bthe answer (is|to life)\\s*.{0,30}?\\b42\\b", "reason": "Grok Hitchhiker's reference" },
    { "pattern": "\\bdon'?t panic\\b", "reason": "Grok Hitchhiker's reference" },
    { "pattern": "\\bhitchhiker'?s guide\\b", "reason": "Grok Hitchhiker's reference" },
    { "pattern": "\\bmostly harmless\\b", "reason": "Grok Hitchhiker's reference" },
    { "pattern": "\\bgrok_card\\b", "reason": "Grok citation-markup artifact leak", "severity": "warning" },
    { "pattern": "\\bgrok_render_citation_card_json\\b", "reason": "Grok citation-markup artifact leak", "severity": "warning" },
    { "pattern": "\\bi'?m grok\\b", "reason": "Grok identity disclaimer" },
    { "pattern": "\\bi am grok\\b", "reason": "Grok identity disclaimer" },
    { "pattern": "\\bas grok,?\\b", "reason": "Grok identity disclaimer" },
    { "pattern": "\\b(built|made|created|developed|trained) by xai\\b", "reason": "Grok identity disclaimer" },
    { "pattern": "\\b(inspired|modeled) (after|on) (the )?hitchhiker'?s guide\\b", "reason": "Grok identity disclaimer" },
    { "pattern": "\\b(elon|musk)\\b.{0,60}?\\b(said|tweeted|posted|thinks|believes)\\b", "reason": "Grok Elon name-drop" },
    { "pattern": "\\bposted on x\\b", "reason": "Grok X name-drop" },
    { "pattern": "\\b(per|according to) (a )?(post|tweet) on x\\b", "reason": "Grok X name-drop" },
    { "pattern": "\\bfrom (posts|tweets) on x\\b", "reason": "Grok X name-drop" },
    { "pattern": "\\b(hope|hoping) (that |this )?(helps|clears (it|that|things) up)(,?\\s*(bud|pal|friend|mate|champ))?\\b", "reason": "Grok closer" },
    { "pattern": "\\bif you want (more|to dig|to go) (detail|deeper|further)\\b", "reason": "Grok closer" },
    { "pattern": "\\b(want|need) me to (dig|dive|go) (deeper|further|into)\\b", "reason": "Grok closer" },
    { "pattern": "\\bready to (dig|dive|go) (in|deeper)\\?", "reason": "Grok closer" },
    { "pattern": "\\bthere you (go|have it)\\b", "reason": "Grok closer" },
    { "pattern": "\\bboom[.!]", "reason": "Grok punctuation tic" },
    { "pattern": "\\band there you have it\\b", "reason": "Grok closer" },
    { "pattern": "\\bfor the record,?\\b", "reason": "Grok assertive hedge" },
    { "pattern": "\\bfull stop\\.", "reason": "Grok assertive closer" },
    { "pattern": "\\bperiod\\.(\\s|$)", "reason": "Grok assertive closer" }
  ]
}
